{
  "$schema": "https://json-schema.org/draft/2020-12/schema",
  "title": "UNO test fixture 1.0",
  "type": "object",
  "required": [
    "schemaVersion",
    "players",
    "drawPile",
    "discardPile",
    "currentPlayerId",
    "direction",
    "currentColor",
    "revision",
    "status",
    "winnerId"
  ],
  "additionalProperties": false,
  "properties": {
    "schemaVersion": {
      "const": "1.0"
    },
    "players": {
      "type": "array",
      "minItems": 2,
      "maxItems": 4,
      "items": {
        "type": "object",
        "required": [
          "id",
          "hand"
        ],
        "additionalProperties": false,
        "properties": {
          "id": {
            "type": "string",
            "minLength": 1
          },
          "hand": {
            "type": "array",
            "minItems": 1,
            "items": {
              "$ref": "#/$defs/Card"
            }
          }
        }
      }
    },
    "drawPile": {
      "type": "array",
      "items": {
        "$ref": "#/$defs/Card"
      }
    },
    "discardPile": {
      "type": "array",
      "minItems": 1,
      "items": {
        "$ref": "#/$defs/Card"
      }
    },
    "currentPlayerId": {
      "type": "string",
      "minLength": 1
    },
    "direction": {
      "type": "integer",
      "enum": [
        -1,
        1
      ]
    },
    "currentColor": {
      "enum": [
        "R",
        "Y",
        "B",
        "G"
      ]
    },
    "revision": {
      "type": "integer",
      "minimum": 0
    },
    "status": {
      "const": "PLAYING"
    },
    "winnerId": {
      "type": "null"
    }
  },
  "$defs": {
    "Card": {
      "type": "object",
      "additionalProperties": false,
      "required": [
        "cardId",
        "color",
        "value"
      ],
      "properties": {
        "cardId": {
          "type": "string",
          "minLength": 1
        },
        "color": {
          "enum": [
            "R",
            "Y",
            "B",
            "G",
            "W"
          ]
        },
        "value": {
          "enum": [
            "0",
            "1",
            "2",
            "3",
            "4",
            "5",
            "6",
            "7",
            "8",
            "9",
            "SKIP",
            "REVERSE",
            "DRAW2",
            "WILD"
          ]
        }
      },
      "oneOf": [
        {
          "properties": {
            "color": {
              "const": "W"
            },
            "value": {
              "const": "WILD"
            }
          }
        },
        {
          "properties": {
            "color": {
              "enum": [
                "R",
                "Y",
                "B",
                "G"
              ]
            },
            "value": {
              "enum": [
                "0",
                "1",
                "2",
                "3",
                "4",
                "5",
                "6",
                "7",
                "8",
                "9",
                "SKIP",
                "REVERSE",
                "DRAW2"
              ]
            }
          }
        }
      ]
    }
  }
}