{
  "schemaVersion": "1.0",
  "players": [
    {
      "id": "A",
      "hand": [
        {
          "cardId": "play",
          "color": "R",
          "value": "1"
        },
        {
          "cardId": "extra",
          "color": "B",
          "value": "9"
        }
      ]
    },
    {
      "id": "B",
      "hand": [
        {
          "cardId": "B",
          "color": "G",
          "value": "4"
        }
      ]
    },
    {
      "id": "C",
      "hand": [
        {
          "cardId": "C",
          "color": "G",
          "value": "4"
        }
      ]
    }
  ],
  "drawPile": [
    {
      "cardId": "d1",
      "color": "Y",
      "value": "2"
    },
    {
      "cardId": "d2",
      "color": "B",
      "value": "3"
    }
  ],
  "discardPile": [
    {
      "cardId": "top",
      "color": "R",
      "value": "1"
    }
  ],
  "currentPlayerId": "A",
  "direction": 1,
  "currentColor": "R",
  "revision": 0,
  "status": "PLAYING",
  "winnerId": null
}